{
    "id": "id",
    "location": {
      "address": "Miami",
      "latitude": -28.51107891831147,
      "longitude": -79.57947854792273
    },
    "name": "urn:sdx:node:amlight.net:Novi06",
    "ports": [
      {
        "id": "id",
        "name": "urn:sdx:port:amlight.net:Novi06:9",
        "node": "urn:sdx:port:amlight.net:Novi06",
        "short_name": "9",
        "status": "up"
      },
      {
        "id": "id",
        "name": "urn:sdx:port:amlight.net:Novi06:9",
        "node": "urn:sdx:port:amlight.net:Novi06",
        "short_name": "9",
        "status": "up"
      }
    ],
    "short_name": "Novi06"
  }